{
  "profileId": "base/capability/storage/storage-capability-base-template",
  "templateId": "storage-capability-base-template",
  "templateKind": "capability-template",
  "templateRole": "base",
  "category": "storage",
  "title": "Storage Capability Base Template",
  "description": "Official canonical base template for storage-oriented capabilities.",
  "baseTemplatePath": "shared/templates/core/capability-core-template",
  "outputTemplatePath": "shared/templates/base/capability/storage-capability-base-template",
  "overlayPath": "shared/authoring/templates/base/capability/storage/storage-capability-base-template/overlay",
  "removePaths": []
}

