{
  "profileId": "base/starter/application/application-base-starter",
  "templateId": "application-base-starter",
  "templateKind": "starter-template",
  "templateRole": "base",
  "category": "application",
  "title": "Application Base Starter Template",
  "description": "Official canonical base starter for interface applications with multi-surface-aware generation.",
  "baseTemplatePath": "shared/templates/core/starter-core-template",
  "outputTemplatePath": "shared/templates/base/starter/application-base-starter",
  "overlayPath": "shared/authoring/templates/base/starter/application/application-base-starter/overlay",
  "removePaths": [
    "starter"
  ]
}
