{
  "profileId": "base/feature/dashboard/dashboard-feature-base-template",
  "templateId": "dashboard-feature-base-template",
  "templateKind": "feature-template",
  "templateRole": "base",
  "category": "dashboard",
  "title": "Dashboard Feature Base Template",
  "description": "Official canonical base template for dashboard-style feature modules.",
  "baseTemplatePath": "shared/templates/core/feature-core-template",
  "outputTemplatePath": "shared/templates/base/feature/dashboard-feature-base-template",
  "overlayPath": "shared/authoring/templates/base/feature/dashboard/dashboard-feature-base-template/overlay",
  "removePaths": []
}

